<?xml version="1.0" encoding="UTF-8"?>
<oktatas xmlns:xsi="http://www.w3.org/2001/XMLSchema-instance" xsi:noNamespaceSchemaLocation="XSDmktjs0.xsd">
    <tanulok>
        <tanulo felhID="1" felhnev="kovacsgergely" olvID="1" eolvID="1" onkurzusID="1">
            <nev>Kovács Gergely</nev>
            <szulIdo>1990-01-01</szulIdo>
            <lakcim>
                <irsz>3500</irsz>
                <varos>Miskolc</varos>
                <utca>Béla utca 3.</utca>
            </lakcim>
        </tanulo>
        <tanulo felhID="2" felhnev="kissjanos" olvID="2" eolvID="2" onkurzusID="2">
            <nev>Kiss János</nev>
            <szulIdo>1991-02-02</szulIdo>
            <lakcim>
                <irsz>3500</irsz>
                <varos>Miskolc</varos>
                <utca>Deák utca 5.</utca>
            </lakcim>
        </tanulo>
        <tanulo felhID="3" felhnev="nagypeter" olvID="3" eolvID="3" onkurzusID="3">
            <nev>Nagy Péter</nev>
            <szulIdo>1992-03-03</szulIdo>
            <lakcim>
                <irsz>3500</irsz>
                <varos>Miskolc</varos>
                <utca>Erzsébet utca 7.</utca>
            </lakcim>
        </tanulo>
        <tanulo felhID="4" felhnev="kisgizi" olvID="4" eolvID="4" onkurzusID="4">
            <nev>Kis Gizella</nev>
            <szulIdo>1995-01-01</szulIdo>
            <lakcim>
                <irsz>3500</irsz>
                <varos>Miskolc</varos>
                <utca>Béla utca 3.</utca>
            </lakcim>
        </tanulo>
    </tanulok>
    <konyvek>
        <konyv kID="1" nyID="1">
            <szerzo>Neil Bradley</szerzo>
            <cim>Az XML-kézikönyv</cim>
            <kiado>Szak kiadó</kiado>
            <megjelenEv>2000</megjelenEv>
            <kategoria>Adatkezelés</kategoria>
            <kategoria>Web</kategoria>
            <kategoria>XML</kategoria>
        </konyv>
        <konyv kID="2" nyID="1">
            <szerzo>Jeffrey D. Ullmann</szerzo>
            <szerzo>Jennifer Widom</szerzo>
            <cim>Adatbázis-rendszerek - Alapvetés</cim>
            <kiado>Panem</kiado>
            <megjelenEv>2009</megjelenEv>
            <kategoria></kategoria>
        </konyv>
        <!-- <konyv kID="3" nyID="1">
            <szerzo></szerzo>
            <cim></cim>
            <kiado></kiado>
            <megjelenEv></megjelenEv>
            <kategoria></kategoria>
        </konyv>
        <konyv kID="4" nyID="1">
            <szerzo></szerzo>
            <cim></cim>
            <kiado></kiado>
            <megjelenEv></megjelenEv>
            <kategoria></kategoria>
        </konyv> -->
    </konyvek>
    <olvasas>
        <olvas olvasID="1" felhID="1" kID="1">
            <kezdete>2021-01-01</kezdete>
            <vege>2021-01-31</vege>
        </olvas>
        <olvas olvasID="2" felhID="2" kID="1">
            <kezdete>2021-01-01</kezdete>
            <vege>2021-01-31</vege>
        </olvas>
        <olvas olvasID="3" felhID="3" kID="1">
            <kezdete>2021-01-01</kezdete>
            <vege>2021-01-31</vege>
        </olvas>
        <olvas olvasID="4" felhID="4" kID="1">
            <kezdete>2021-01-01</kezdete>
            <vege>2021-01-31</vege>
        </olvas>
    </olvasas>
    <eolvasas>
        <ebook eID="1" nyID="2">
            <szerzo>Sashi Banzal</szerzo>
            <cim>XML Basics</cim>
            <kiado>Mercury Learning and Information</kiado>
            <megjelenEv>2020</megjelenEv>
            <link>https://www.packtpub.com/en-hu/product/xml-basics-9781836648741</link>
        </ebook>
        <!-- <ebook eID="2" nyID="2">
            <szerzo></szerzo>
            <cim></cim>
            <kiado></kiado>
            <megjelenEv></megjelenEv>
            <link></link>
        </ebook>
        <ebook eID="3" nyID="2">
            <szerzo></szerzo>
            <cim></cim>
            <kiado></kiado>
            <megjelenEv></megjelenEv>
            <link></link>
        </ebook>
        <ebook eID="4" nyID="2">
            <szerzo></szerzo>
            <cim></cim>
            <kiado></kiado>
            <megjelenEv></megjelenEv>
            <link></link>
        </ebook> -->
    </eolvasas>
    <onkurzusok>
        <onkurzus oID="1" nyID="2">
            <cim>XML Mastery: Unleashing the Power of Data Markup</cim>
            <kiado>EDUCBA Bridging the Gap</kiado>
            <megjelenEv>2024</megjelenEv>
            <link>https://www.udemy.com/course/xml-novice-to-ninja/</link>
        </onkurzus>
        <onkurzus oID="2" nyID="2">
            <cim>XML Essentials: Structure and Share Data Efficiently.</cim>
            <kiado>Faris Azam</kiado>
            <megjelenEv>2024</megjelenEv>
            <link>https://www.udemy.com/course/xml-essentials-structure-and-share-data-efficiently/</link>
        </onkurzus>
        <!-- <onkurzus oID="3" nyID="2">
            <cim></cim>
            <kiado></kiado>
            <megjelenEv></megjelenEv>
            <link></link>
        </onkurzus>
        <onkurzus oID="4" nyID="2">
            <cim></cim>
            <kiado></kiado>
            <megjelenEv></megjelenEv>
            <link></link>
        </onkurzus> -->
    </onkurzusok>
    <oktatok>
        <oktato oktID="1">
            <nev></nev>
            <email></email>
            <weboldal></weboldal>
        </oktato>
        <oktato oktID="2">
            <nev></nev>
            <email></email>
            <weboldal></weboldal>
        </oktato>
        <oktato oktID="3">
            <nev></nev>
            <email></email>
            <weboldal></weboldal>
        </oktato>
        <oktato oktID="4">
            <nev></nev>
            <email></email>
            <weboldal></weboldal>
        </oktato>
    </oktatok>
    <nyelvek>
        <nyelv nyID="1">
            <nev>Magyar</nev>
        </nyelv>
        <nyelv nyID="2">
            <nev>Angol</nev>
        </nyelv>
        <nyelv nyID="3">
            <nev>Német</nev>
        </nyelv>
    </nyelvek>
</oktatas>
